{
  "schema_version": 2,
  "intent_id": "pr277_issue276_durable_parallel_task_batches_v3",
  "repository": "dddd2024/reverse-agent",
  "source_pr": 277,
  "locked_base_sha": "3d2fa35d1baeec3f2b52706746e54d7f0eb0af46",
  "allowed_merge_method": "merge",
  "decision_identity": {
    "decision_id": "decision_20260821_issue276_durable_parallel_task_batches_r2_v3",
    "decision_content_sha256": "8250f8158047582cafd0494346a4db9c6922bc6a336768e07ccaac5d5986e3c6"
  },
  "command_plan_sha256": "4feeb790348d8a763abf043caa8f79847452c243654e862679fa3a6042885e27",
  "merge_tree_policy": "equal_to_accepted_head_tree",
  "required_workflows": [
    "CI",
    "Decision Preflight",
    "State Gate (pull_request)"
  ],
  "expires_at": "2026-08-28T23:59:59Z"
}
